{
  "$schema": "http://json-schema.org/draft/2020-12/schema",
  "$id": "https://gobl.org/draft-0/tax/region",
  "$ref": "#/$defs/Region",
  "$defs": {
    "Category": {
      "properties": {
        "code": {
          "type": "string",
          "title": "Code"
        },
        "name": {
          "$ref": "https://gobl.org/draft-0/i18n/string",
          "title": "Name"
        },
        "desc": {
          "$ref": "https://gobl.org/draft-0/i18n/string",
          "title": "Description"
        },
        "retained": {
          "type": "boolean",
          "title": "Retained",
          "description": "Retained when true implies that the tax amount will be retained\nby the buyer on behalf of the supplier, and thus subtracted from\nthe invoice taxable base total. Typically used for taxes related to\nincome."
        },
        "rates": {
          "items": {
            "$ref": "#/$defs/Rate"
          },
          "type": "array",
          "title": "Rates",
          "description": "Specific tax definitions inside this category."
        }
      },
      "type": "object",
      "required": [
        "code",
        "name",
        "rates"
      ],
      "description": "Category contains the definition of a general type of tax inside a region."
    },
    "Note": {
      "properties": {
        "key": {
          "type": "string",
          "title": "Key",
          "description": "Key specifying subject of the text"
        },
        "code": {
          "type": "string",
          "title": "Code",
          "description": "Code used for additional data that may be required to identify the note."
        },
        "src": {
          "type": "string",
          "title": "Source",
          "description": "Source of this note, especially useful when auto-generated."
        },
        "text": {
          "type": "string",
          "title": "Text",
          "description": "The contents of the note"
        }
      },
      "type": "object",
      "required": [
        "text"
      ],
      "description": "Note represents a free text of additional information that may be added to a document."
    },
    "Rate": {
      "properties": {
        "key": {
          "type": "string",
          "title": "Key",
          "description": "Key identifies this rate within the system"
        },
        "name": {
          "$ref": "https://gobl.org/draft-0/i18n/string",
          "title": "Name"
        },
        "desc": {
          "$ref": "https://gobl.org/draft-0/i18n/string",
          "title": "Description"
        },
        "values": {
          "items": {
            "$ref": "#/$defs/RateValue"
          },
          "type": "array",
          "title": "Values",
          "description": "Values contains a list of Value objects that contain the\ncurrent and historical percentage values for the rate;\norder is important, newer values should come before\nolder values."
        }
      },
      "type": "object",
      "required": [
        "key",
        "name",
        "values"
      ],
      "description": "Rate defines a single rate inside a category"
    },
    "RateValue": {
      "properties": {
        "since": {
          "$ref": "https://gobl.org/draft-0/cal/date",
          "title": "Since",
          "description": "Date from which this value should be applied."
        },
        "percent": {
          "$ref": "https://gobl.org/draft-0/num/percentage",
          "title": "Percent",
          "description": "Rate that should be applied"
        },
        "disabled": {
          "type": "boolean",
          "title": "Disabled",
          "description": "When true, this value should no longer be used."
        }
      },
      "type": "object",
      "required": [
        "percent"
      ],
      "description": "RateValue contains a percentage rate or fixed amount for a given date range."
    },
    "Region": {
      "properties": {
        "name": {
          "$ref": "https://gobl.org/draft-0/i18n/string",
          "title": "Name",
          "description": "Name of the region"
        },
        "country": {
          "type": "string",
          "title": "Code",
          "description": "Country code for the region"
        },
        "locality": {
          "type": "string",
          "title": "Locality",
          "description": "Locality, city, region, or similar code inside the country, if needed."
        },
        "currency": {
          "type": "string",
          "title": "Currency",
          "description": "Currency used by the region for tax purposes."
        },
        "schemes": {
          "$ref": "#/$defs/Schemes",
          "title": "Schemes",
          "description": "Set of specific scheme definitions inside the region."
        },
        "categories": {
          "items": {
            "$ref": "#/$defs/Category"
          },
          "type": "array",
          "title": "Categories",
          "description": "List of tax categories."
        }
      },
      "type": "object",
      "required": [
        "name",
        "country",
        "currency",
        "categories"
      ],
      "description": "Region defines the holding structure for a regions categories and subsequent Rates and Values."
    },
    "Scheme": {
      "properties": {
        "key": {
          "type": "string",
          "title": "Key",
          "description": "Key used to identify this scheme"
        },
        "name": {
          "$ref": "https://gobl.org/draft-0/i18n/string",
          "title": "Name",
          "description": "Name of this scheme."
        },
        "description": {
          "$ref": "https://gobl.org/draft-0/i18n/string",
          "title": "Description",
          "description": "Human details describing what this scheme is used for."
        },
        "categories": {
          "items": {
            "type": "string"
          },
          "type": "array",
          "title": "Category Codes",
          "description": "List of tax category codes that can be used when this scheme is\napplied."
        },
        "note": {
          "$ref": "#/$defs/Note",
          "title": "Note",
          "description": "Notes defines messages that should be added to a document\nwhen this scheme is used."
        }
      },
      "type": "object",
      "required": [
        "key",
        "name"
      ],
      "description": "Scheme contains the definition of a scheme that belongs to a region and can be used to simplify validation processes for document contents."
    },
    "Schemes": {
      "items": {
        "$ref": "#/$defs/Scheme"
      },
      "type": "array",
      "description": "Schemes defines an array of scheme objects with helper functions."
    }
  },
  "$comment": "Generated with GOBL v0.22.0"
}