{
  "$schema": "https://gobl.org/draft-0/tax/region",
  "name": {
    "en": "Spain",
    "es": "España"
  },
  "country": "ES",
  "currency": "EUR",
  "schemes": [
    {
      "key": "reverse-charge",
      "name": {
        "en": "Reverse Charge",
        "es": "Inversión del sujeto pasivo"
      },
      "categories": [
        "VAT"
      ],
      "note": {
        "key": "legal",
        "src": "reverse-charge",
        "text": "Reverse Charge / Inversión del sujeto pasivo."
      }
    },
    {
      "key": "customer-rates",
      "name": {
        "en": "Customer Country Rates",
        "es": "Tasas del País del Cliente"
      },
      "description": {
        "en": "Use the customers country to determine tax rates."
      }
    },
    {
      "key": "simplified",
      "name": {
        "en": "Simplified tax scheme",
        "es": "Contribuyente en régimen simplificado"
      },
      "note": {
        "key": "legal",
        "src": "simplified",
        "text": "Factura expedida por contibuyente en régimen simplificado."
      }
    },
    {
      "key": "customer-issued",
      "name": {
        "en": "Customer issued invoice",
        "es": "Facturación por el destinatario"
      },
      "note": {
        "key": "legal",
        "src": "customer-issued",
        "text": "Facturación por el destinatario."
      }
    },
    {
      "key": "travel-agency",
      "name": {
        "en": "Special scheme for travel agencies",
        "es": "Régimen especial de las agencias de viajes"
      },
      "note": {
        "key": "legal",
        "src": "travel-agency",
        "text": "Régimen especial de las agencias de viajes."
      }
    },
    {
      "key": "second-hand-goods",
      "name": {
        "en": "Special scheme for second-hand goods",
        "es": "Régimen especial de los bienes usados"
      },
      "note": {
        "key": "legal",
        "src": "second-hand-goods",
        "text": "Régimen especial de los bienes usados."
      }
    },
    {
      "key": "art",
      "name": {
        "en": "Special scheme of works of art",
        "es": "Régimen especial de los objetos de arte"
      },
      "note": {
        "key": "legal",
        "src": "art",
        "text": "Régimen especial de los objetos de arte."
      }
    },
    {
      "key": "antiques",
      "name": {
        "en": "Special scheme of antiques and collectables",
        "es": "Régimen especial de las antigüedades y objetos de colección"
      },
      "note": {
        "key": "legal",
        "src": "antiques",
        "text": "Régimen especial de las antigüedades y objetos de colección."
      }
    },
    {
      "key": "cash-basis",
      "name": {
        "en": "Special scheme on cash basis",
        "es": "Régimen especial del criterio de caja"
      },
      "note": {
        "key": "legal",
        "src": "cash-basis",
        "text": "Régimen especial del criterio de caja."
      }
    }
  ],
  "categories": [
    {
      "code": "VAT",
      "name": {
        "en": "VAT",
        "es": "IVA"
      },
      "desc": {
        "en": "Value Added Tax",
        "es": "Impuesto sobre el Valor Añadido"
      },
      "rates": [
        {
          "key": "zero",
          "name": {
            "en": "Zero Rate",
            "es": "Tipo Zero"
          },
          "values": [
            {
              "percent": "0.0%"
            }
          ]
        },
        {
          "key": "standard",
          "name": {
            "en": "Standard Rate",
            "es": "Tipo General"
          },
          "values": [
            {
              "since": "2012-09-01",
              "percent": "21.0%"
            },
            {
              "since": "2010-07-01",
              "percent": "18.0%"
            },
            {
              "since": "1995-01-01",
              "percent": "16.0%"
            },
            {
              "since": "1993-01-01",
              "percent": "15.0%"
            }
          ]
        },
        {
          "key": "reduced",
          "name": {
            "en": "Reduced Rate",
            "es": "Tipo Reducido"
          },
          "values": [
            {
              "since": "2012-09-01",
              "percent": "10.0%"
            },
            {
              "since": "2010-07-01",
              "percent": "8.0%"
            },
            {
              "since": "1995-01-01",
              "percent": "7.0%"
            },
            {
              "since": "1993-01-01",
              "percent": "6.0%"
            }
          ]
        },
        {
          "key": "super-reduced",
          "name": {
            "en": "Super-Reduced Rate",
            "es": "Tipo Superreducido"
          },
          "values": [
            {
              "since": "1995-01-01",
              "percent": "4.0%"
            },
            {
              "since": "1993-01-01",
              "percent": "3.0%"
            }
          ]
        }
      ]
    },
    {
      "code": "VATEQS",
      "name": {
        "en": "VAT Equalization Surcharge",
        "es": "IVA Recargo de Equivalencia"
      },
      "rates": [
        {
          "key": "standard",
          "name": {
            "en": "Standard Rate",
            "es": "Tipo General"
          },
          "values": [
            {
              "since": "2012-09-01",
              "percent": "5.2%"
            },
            {
              "since": "1993-01-01",
              "percent": "4.0%"
            }
          ]
        },
        {
          "key": "reduced",
          "name": {
            "en": "Reduced Rate",
            "es": "Tipo Reducido"
          },
          "values": [
            {
              "since": "2012-09-01",
              "percent": "1.4%"
            },
            {
              "since": "1993-01-01",
              "percent": "1.0%"
            }
          ]
        },
        {
          "key": "super-reduced",
          "name": {
            "en": "Super-Reduced Rate",
            "es": "Tipo Superreducido"
          },
          "values": [
            {
              "since": "1993-01-01",
              "percent": "0.5%"
            }
          ]
        },
        {
          "key": "tobacco",
          "name": {
            "en": "Tobacco Rate",
            "es": "Tipo Tobaco"
          },
          "values": [
            {
              "since": "2007-01-01",
              "percent": "1.75%"
            }
          ]
        }
      ]
    },
    {
      "code": "IRPF",
      "name": {
        "en": "IRPF",
        "es": "IRPF"
      },
      "desc": {
        "en": "Personal income tax.",
        "es": "Impuesto sobre la renta de las personas físicas."
      },
      "retained": true,
      "rates": [
        {
          "key": "pro",
          "name": {
            "en": "Professional Rate",
            "es": "Professionales"
          },
          "values": [
            {
              "since": "2015-07-12",
              "percent": "15.0%"
            },
            {
              "since": "2015-01-01",
              "percent": "19.0%"
            },
            {
              "since": "2012-09-01",
              "percent": "21.0%"
            },
            {
              "since": "2007-01-01",
              "percent": "15.0%"
            }
          ]
        },
        {
          "key": "pro-start",
          "name": {
            "en": "Professional Starting Rate",
            "es": "Professionales Inicio"
          },
          "values": [
            {
              "since": "2007-01-01",
              "percent": "7.0%"
            }
          ]
        },
        {
          "key": "capital",
          "name": {
            "en": "Rental or Interest Capital",
            "es": "Alquileres o Intereses de Capital"
          },
          "values": [
            {
              "since": "2007-01-01",
              "percent": "19.0%"
            }
          ]
        },
        {
          "key": "modules",
          "name": {
            "en": "Modules Rate",
            "es": "Tipo Modulos"
          },
          "values": [
            {
              "since": "2007-01-01",
              "percent": "1.0%"
            }
          ]
        }
      ]
    }
  ]
}