{
  "$schema": "https://gobl.org/draft-0/tax/regime",
  "name": {
    "en": "The Netherlands",
    "nl": "Nederland"
  },
  "country": "NL",
  "currency": "EUR",
  "categories": [
    {
      "code": "VAT",
      "name": {
        "en": "VAT",
        "nl": "BTW"
      },
      "desc": {
        "en": "Value Added Tax",
        "nl": "Belasting Toegevoegde Waarde"
      },
      "rates": [
        {
          "key": "zero",
          "name": {
            "en": "Zero Rate",
            "nl": "0%-tarief"
          },
          "values": [
            {
              "percent": "0.0%"
            }
          ]
        },
        {
          "key": "standard",
          "name": {
            "en": "Standard Rate",
            "nl": "Standaardtarief"
          },
          "values": [
            {
              "percent": "21.0%"
            }
          ]
        },
        {
          "key": "reduced",
          "name": {
            "en": "Reduced Rate",
            "nl": "Gereduceerd Tarief"
          },
          "values": [
            {
              "percent": "9.0%"
            }
          ]
        }
      ]
    }
  ]
}